code,name
45.11.2,Розничная торговля автомобилями и легкими автотранспортными средствами в торговых объектах с торговой площадью менее 2000 кв.м
45.11.3,Розничная торговля автомобилями и легкими автотранспортными средствами в торговых объектах с торговой площадью более 2000 кв.м (2000 кв.м и выше)
45.19,Торговля прочими автотранспортными средствами
45.19.1,Оптовая торговля прочими автотранспортными средствами
45.19.2,Розничная торговля прочими автотранспортными средствами в торговых объектах с торговой площадью менее 2000 кв.м
45.19.3,Розничная торговля прочими автотранспортными средствами в торговых объектах с торговой площадью более 2000 кв.м (2000 кв.м и выше)
45.20,Техническое обслуживание и ремонт автомобилей
45.20.1,"Техническое обслуживание и ремонт автомобилей, за исключением произведенных станциями технического обслуживания, находящимися на придорожной полосе"
45.20.2,"Техническое обслуживание и ремонт автомобилей станциями технического обслуживания, находящимися на придорожной полосе"
45.20.3,Деятельность по зарядке аккумуляторных батарей транспортных средств с электродвигателями
45.31,"Автомобильдерге арналған бөлшектер, түйіндер мен жабдықтарды көтерме саудада сату"
45.31.0,"Оптовая торговля автомобильными деталями, узлами и принадлежностями"
45.32,"Розничная торговля автомобильными деталями, узлами и принадлежностями"
45.32.1,"Розничная торговля автомобильными деталями, узлами и принадлежностями в торговых объектах с торговой площадью менее 2000 кв.м"
45.32.2,"Розничная торговля автомобильными деталями, узлами и принадлежностями в торговых объектах с торговой площадью более 2000 кв.м (2000 кв.м и выше)"
45.40,"Торговля мотоциклами, их деталями, узлами и принадлежностями; техническое обслуживание и ремонт мотоциклов"
45.40.1,"Оптовая торговля мотоциклами, мотороллерами, деталями и принадлежностями к ним"
45.40.2,"Розничная торговля мотоциклами, мотороллерами, деталями и принадлежностями к ним"
45.40.3,Техническое обслуживание и ремонт мотоциклов и мотороллеров
46,"Оптовая торговля, за исключением торговли автомобилями и мотоциклами"
46.1,Оптовая торговля за вознаграждение или на договорной основе
46.2,Оптовая торговля сельскохозяйственным сырьем и живыми животными
46.3,"Оптовая торговля продуктами питания, напитками и табачными изделиями"
46.4,Оптовая торговля непродовольственными товарами потребительского назначения
46.5,Оптовая торговля компьютерами и коммуникационным оборудованием
46.6,"Оптовая торговля прочими машинами, оборудованием и деталями и принадлежностями к ним"
46.7,Прочая специализированная оптовая торговля
46.9,Неспециализированная оптовая торговля
46.11,"Деятельность агентов по оптовой торговле сельскохозяйственным сырьем, живыми животными, текстильным сырьем и полуфабрикатами"
46.11.0,"Деятельность агентов по оптовой торговле сельскохозяйственным сырьем, живыми животными, текстильным сырьем и полуфабрикатами"
46.12,"Деятельность агентов по оптовой торговле топливом, рудами, металлами и химическими веществами"
46.12.0,"Деятельность агентов по оптовой торговле топливом, рудами, металлами и химическими веществами"
46.13,Деятельность агентов по оптовой торговле древесиной и строительными материалами
46.13.0,Деятельность агентов по оптовой торговле древесиной и строительными материалами
46.14,"Деятельность агентов по оптовой торговле машинами, оборудованием, судами и летательными аппаратами"
46.14.0,"Деятельность агентов по оптовой торговле машинами, оборудованием, судами и летательными аппаратами"
46.15,"Деятельность агентов по оптовой торговле мебелью, бытовыми товарами, скобяными и прочими металлическими изделиями"
46.15.0,"Деятельность агентов по оптовой торговле мебелью, бытовыми товарами, скобяными и прочими металлическими изделиями"
46.16,"Деятельность агентов по оптовой торговле текстильными изделиями, одеждой, обувью, изделиями из кожи и меха"
46.16.0,"Деятельность агентов по оптовой торговле текстильными изделиями, одеждой, обувью, изделиями из кожи и меха"
46.17,"Деятельность агентов по оптовой торговле пищевыми продуктами, напитками и табачными изделиями"
46.17.0,"Деятельность агентов по оптовой торговле пищевыми продуктами, напитками и табачными изделиями"
46.18,"Деятельность агентов, специализирующихся на оптовой торговле отдельными видами товаров или группами товаров, не включенными в другие группировки"
46.18.0,"Деятельность агентов, специализирующихся на оптовой торговле отдельными видами товаров или группами товаров, не включенными в другие группировки"
46.19,Деятельность агентов по оптовой торговле товарами широкого ассортимента
46.19.0,Деятельность агентов по оптовой торговле товарами широкого ассортимента
46.21,"Оптовая торговля зерном, необработанным табаком, семенами и кормами для животных"
46.21.1,"Оптовая торговля зерном, семенами и кормами для животных"
46.21.2,Оптовая торговля необработанным табаком
46.21.3,Оптовая торговля масличными культурами
46.22,Оптовая торговля цветами и другими растениями
46.22.0,Оптовая торговля цветами и другими растениями
46.23,Оптовая торговля живыми животными
46.23.0,Оптовая торговля живыми животными
46.24,Оптовая торговля шкурами и кожей
46.24.0,Оптовая торговля шкурами и кожей
46.31,Оптовая торговля фруктами и овощами
46.31.0,Оптовая торговля фруктами и овощами
46.32,Оптовая торговля мясом и мясными продуктами
46.32.0,Оптовая торговля мясом и мясными продуктами
46.33,"Оптовая торговля молочными продуктами, яйцами и пищевыми маслами и жирами"
46.33.0,"Оптовая торговля молочными продуктами, яйцами и пищевыми маслами и жирами"
46.34,Оптовая торговля напитками
46.34.1,"Оптовая торговля напитками в магазинах, являющихся торговыми объектами, с торговой площадью менее 2000 кв.м"
46.34.2,"Оптовая торговля напитками в магазинах, являющихся торговыми объектами, с торговой площадью более 2000 кв.м (2000 кв.м и выше), включая оптово-продовольственные распределительные центры"
46.35,Оптовая торговля табачными изделиями
46.35.0,Оптовая торговля табачными изделиями
46.36,"Оптовая торговля сахаром, шоколадом и сахаристыми кондитерскими изделиями"
46.36.0,"Оптовая торговля сахаром, шоколадом и сахаристыми кондитерскими изделиями"
46.37,"Оптовая торговля кофе, чаем, какао и специями"
46.37.0,"Оптовая торговля кофе, чаем, какао и специями"
46.38,"Оптовая торговля прочими продуктами питания, включая рыбу, ракообразных и моллюсков"
46.38.1,Оптовая торговля рыбой и рыбными продуктами
46.38.9,Оптовая торговля прочими продуктами питания
46.39,"Неспециализированная оптовая торговля продуктами питания, напитками и табачными изделиями"
46.39.0,"Неспециализированная оптовая торговля продуктами питания, напитками и табачными изделиями"
46.41,Оптовая торговля текстильными изделиями
46.41.0,Оптовая торговля текстильными изделиями
46.42,Оптовая торговля одеждой и обувью
46.42.1,Оптовая торговля трикотажными и чулочно-носочными изделиями
46.42.2,"Оптовая торговля одеждой, кроме трикотажных и чулочно-носочных изделий"
46.42.3,Оптовая торговля обувью
46.43,"Оптовая торговля бытовыми электротоварами, радио- и телевизионным оборудованием"
46.43.1,Оптовая торговля бытовыми электротоварами
46.43.2,Оптовая торговля радио- и телевизионным оборудованием
46.44,"Оптовая торговля изделиями из керамики и стекла, чистящими средствами"
46.44.0,"Оптовая торговля изделиями из керамики и стекла, чистящими средствами"
46.45,Оптовая торговля парфюмерными и косметическими средствами
46.45.0,Оптовая торговля парфюмерными и косметическими средствами
46.46,Оптовая торговля фармацевтическими товарами
46.46.1,"Оптовая торговля фармацевтическими товарами, кроме торговли медицинской техникой и ортопедическими изделиями"
46.46.2,Оптовая реализация фармацевтических и медицинских товаров в рамках гарантированного объема бесплатной медицинской помощи
46.46.3,Оптовая торговля медицинской техникой и ортопедическими изделиями
46.47,"Оптовая торговля мебелью, коврами и осветительным оборудованием"
46.47.0,"Оптовая торговля мебелью, коврами и осветительным оборудованием"
46.48,Оптовая торговля часами и ювелирными изделиями
46.48.0,Оптовая торговля часами и ювелирными изделиями
46.49,Оптовая торговля прочими непродовольственными товарами потребительского назначения
46.49.1,Оптовая торговля канцелярскими принадлежностями
46.49.2,Оптовая торговля музыкальными инструментами
46.49.9,"Оптовая торговля прочими непродовольственными товарами потребительского назначения, не включенными в другие группировки"
46.51,"Оптовая торговля компьютерами, периферийным компьютерным оборудованием и программным обеспечением"
46.51.0,"Оптовая торговля компьютерами, периферийным компьютерным оборудованием и программным обеспечением"
46.52,Оптовая торговля электронным и телекоммуникационным оборудованием и их частями
46.52.0,Оптовая торговля электронным и телекоммуникационным оборудованием и их частями
46.61,"Оптовая торговля сельскохозяйственной техникой, оборудованием, деталями и принадлежностями к ним"
46.61.0,"Оптовая торговля сельскохозяйственной техникой, оборудованием, деталями и принадлежностями к ним"
46.62,Оптовая торговля станками
46.62.0,Оптовая торговля станками
46.63,Оптовая торговля машинами и оборудованием для горнодобывающей промышленности и строительства
46.63.0,Оптовая торговля машинами и оборудованием для горнодобывающей промышленности и строительства
46.64,Оптовая торговля машинами и оборудованием для текстильной промышленности и швейными и вязальными машинами
46.64.0,Оптовая торговля машинами и оборудованием для текстильной промышленности и швейными и вязальными машинами
46.65,Оптовая торговля офисной мебелью
46.65.0,Оптовая торговля офисной мебелью
46.66,Оптовая торговля прочими офисными машинами и оборудованием
46.66.0,Оптовая торговля прочими офисными машинами и оборудованием
46.69,Оптовая торговля прочими машинами и оборудованием
46.69.0,Оптовая торговля прочими машинами и оборудованием
46.71,"Оптовая торговля твердым, жидким и газообразным топливом и подобными продуктами"
46.71.1,Оптовая торговля сырой нефтью и попутным газом
46.71.2,Оптовая торговля природным (горючим) газом
46.71.3,Оптовая торговля каменным углем
46.71.4,Оптовая торговля лигнитом (бурым углем)
46.71.5,Оптовая торговля авиационным бензином и керосином
46.71.6,Оптовая торговля автомобильным бензином
46.71.7,Оптовая торговля дизельным топливом
46.71.8,Оптовая торговля мазутом топочным
46.71.9,Оптовая торговля прочим топливом
46.72,Оптовая торговля металлами и металлическими рудами
46.72.1,Оптовая торговля рудами черных и цветных металлов
46.72.2,"Оптовая торговля чугуном, сталью и их литьем"
46.72.3,"Оптовая торговля редкими, редкоземельными и цветными металлами и их литьем"
46.72.4,Оптовая торговля драгоценными металлами
46.73,"Оптовая торговля лесоматериалами, строительными материалами и санитарно-техническим оборудованием"
46.73.1,Оптовая торговля листовым стеклом
46.73.2,"Оптовая торговля цементом, песком и гравием"
46.73.3,"Оптовая торговля изделиями из бетона, цемента, гипса и аналогичных материалов"
46.73.4,"Оптовая торговля лакокрасочной продукцией, обоями и напольными покрытиями"
46.73.5,Оптовая торговля древесиной и продукцией обработки древесины
46.73.6,Оптовая торговля строительными металлическими конструкциями
46.73.7,Оптовая торговля санитарно-техническим оборудованием
46.73.8,Оптовая торговля стеновыми блоками
46.74,"Оптовая торговля скобяными изделиями, водопроводным и отопительным оборудованием и инвентарем"
46.74.0,"Оптовая торговля скобяными изделиями, водопроводным и отопительным оборудованием и инвентарем"
46.75,Оптовая торговля химической продукцией
46.75.1,Оптовая торговля химическими веществами и химическими продуктами
46.75.2,Оптовая торговля резинотехническими изделиями
46.75.3,Оптовая торговля минеральными удобрениями
46.75.4,Оптовая торговля пестицидами и прочими агрохимическими продуктами
46.76,Оптовая торговля прочими промежуточными продуктами
46.76.1,Оптовая торговля пластмассами в первичных формах и синтетическим каучуком
46.76.2,Оптовая торговля прочими промежуточными продуктами
46.76.3,Оптовая торговля драгоценными камнями
46.77,Оптовая торговля отходами и ломом
46.77.1,Оптовая торговля ломом и отходами черных и цветных металлов
46.77.2,Оптовая торговля ломом драгоценных металлов и драгоценных камней
46.77.9,Оптовая торговля прочими неметаллическими отходами и неметаллическим ломом
46.90,Неспециализированная оптовая торговля
46.90.1,Оптовая торговля полудрагоценными камнями
46.90.2,Оптовая торговля мореным дубом
46.90.3,"Оптовая торговля широким ассортиментом товаров без какой-либо конкретизации в торговых объектах с торговой площадью более 2000 кв.м (2000 кв.м и выше), включая оптово-продовольственные распределительные центры"
46.90.4,"Оптовая торговля оборудованием и материалами, бывшими в употреблении"
46.90.5,Оптовая торговля углеродными единицами
46.90.8,"Специализированная оптовая торговля товарами, не включенными в другие группировки"
46.90.9,Оптовая торговля широким ассортиментом товаров без какой-либо конкретизации
47,"Розничная торговля, кроме торговли автомобилями и мотоциклами"
47.1,Розничная торговля в неспециализированных магазинах
47.2,"Розничная торговля продуктами питания, напитками и табачными изделиями в специализированных магазинах"
47.3,Розничная торговля топливом в специализированных магазинах
47.4,Розничная торговля компьютерами и коммуникационным оборудованием в специализированных магазинах
47.5,Розничная торговля прочими бытовыми товарами в специализированных магазинах
47.6,Розничная торговля товарами культурно-развлекательного характера в специализированных магазинах
47.7,Розничная торговля прочими товарами в специализированных магазинах
47.8,"Розничная торговля в палатках, киосках и на рынках"
47.9,"Розничная торговля вне магазинов, палаток, киосков или рынков"
47.11,"Розничная торговля в неспециализированных магазинах преимущественно продуктами питания, напитками и табачными изделиями"
47.11.1,"Розничная торговля преимущественно продуктами питания, напитками и табачными изделиями в неспециализированных магазинах, являющихся торговыми объектами, с торговой площадью менее 2000 кв.м"
47.11.2,"Розничная торговля преимущественно продуктами питания, напитками и табачными изделиями, в неспециализированных магазинах, являющихся торговыми объектами, с торговой площадью более 2000 кв.м (2000 кв.м и выше)"
47.19,Прочая розничная торговля в неспециализированных магазинах
47.19.1,"Прочая розничная торговля в неспециализированных магазинах, являющихся торговыми объектами, с торговой площадью менее 2000 кв.м"
47.19.2,"Прочая розничная торговля в неспециализированных магазинах, являющихся торговыми объектами, с торговой площадью более 2000 кв.м (2000 кв.м и выше)"
