code,name
62.01.4,Деятельность в области разработки технической документации и системной архитектуры
62.02,Консультационные услуги в области информационных технологий
62.02.0,Консультационные услуги в области информационных технологий
62.03,Деятельность по управлению компьютерным оборудованием
62.03.1,Системно-техническое обслуживание аппаратно-программных комплексов
62.03.2,Деятельность в области монтажа и настройки аппаратно-программных комплексов
62.09,Другие виды деятельности в области информационных технологий и информационных систем
62.09.2,Деятельность в области кибербезопасности
62.09.9,Другие виды деятельности в области информационных технологий
63,Деятельность в области информационного обслуживания
63.1,"Обработка данных, размещение приложений (прикладных программ) и связанная с этим деятельность; деятельность веб-порталов"
63.9,Прочая деятельность в области информационного обслуживания
63.11,"Обработка данных, размещение приложений (прикладных программ) и связанная с этим деятельность"
63.11.1,Деятельность по предоставлению в пользование серверных помещений (центров обработки данных)
63.11.3,Деятельность по осуществлению цифрового майнинга
63.11.4,Деятельность в области обработки данных
63.11.5,"Предоставление в пользование программных продуктов, электронных информационных ресурсов, мобильных и иных приложений"
63.12,Деятельность веб-порталов
63.12.0,Деятельность веб-порталов
63.91,Деятельность информационных агентств
63.91.0,Деятельность информационных агентств
63.99,"Прочая деятельность в области информационного обслуживания, не включенная в другие группировки"
63.99.1,"Прочие виды деятельности, связанные с предоставлением компьютеризированных услуг телефонной связи"
63.99.9,Прочие виды деятельности в области информационного обслуживания
64,"Финансовое посредничество, кроме страхования и пенсионного обеспечения"
64.1,Денежное посредничество
64.2,Деятельность холдинговых компаний
64.3,"Деятельность трастовых компаний, инвестиционных фондов и аналогичных финансовых организаций"
64.9,"Прочее финансовое посредничество, кроме страхования и пенсионного обеспечения"
64.11,Деятельность национального банка
64.11.0,Деятельность национального банка
64.19,Прочее денежное посредничество
64.19.1,"Деятельность банков, за исключением, банка, являющегося национальным институтом развития, и его дочерней организации-лизингодателя"
64.19.2,Деятельность сберегательных банков
64.19.3,"Деятельность банка, являющегося национальным институтом развития, и его дочерней организации-лизингодателя"
64.19.9,Денежное посредничество прочих финансовых учреждений
64.20,Деятельность холдинговых компаний
64.20.0,Деятельность холдинговых компаний
64.30,"Деятельность трастовых компаний, инвестиционных фондов и аналогичных финансовых организаций"
64.30.0,"Деятельность трастовых компаний, инвестиционных фондов и аналогичных финансовых организаций"
64.91,Финансовый лизинг
64.91.1,"Финансовый лизинг, кроме финансового лизинга медицинского оборудования и техники"
64.91.2,Финансовый лизинг медицинского оборудования и техники
64.92,Прочие виды кредитования
64.92.1,Деятельность ломбардов
64.92.2,Деятельность специальных фондов финансовой поддержки субъектов частного предпринимательства
64.92.9,"Прочие виды кредитования, не включенные в другие группировки"
64.99,"Прочее финансовое посредничество, кроме страхования и пенсионного обеспечения, не включенное в другие группировки"
64.99.1,"Финансово-экономические услуги, оказываемые субъектам индустриально-инновационной деятельности и агропромышленного комплекса"
64.99.2,"Другие финансовые услуги, финансирование в различных отраслях экономики, инвестиционная деятельность"
64.99.9,"Другие виды финансовых услуг, кроме страхования и пенсионного обеспечения, не включенные в другие группировки"
65,"Страхование, перестрахование и пенсионное обеспечение, кроме обязательного социального обеспечения"
65.1,Страхование
65.2,Перестрахование
65.3,Пенсионное обеспечение
65.11,Страхование жизни
65.11.1,Государственное страхование жизни
65.11.2,Негосударственное страхование жизни
65.12,Страхование ущерба
65.12.1,Государственное страхование ущерба
65.12.2,Негосударственное страхование ущерба
65.20,Перестрахование
65.20.0,Перестрахование
65.30,Пенсионное обеспечение
65.30.1,Государственное пенсионное обеспечение
65.30.2,Негосударственное пенсионное обеспечение
66,Вспомогательная деятельность в сфере финансовых услуг и страхования
66.1,"Вспомогательная деятельность в сфере финансовых услуг, кроме страхования и пенсионного обеспечения"
66.2,Вспомогательная деятельность по страхованию и пенсионному обеспечению
66.3,Деятельность по управлению фондами
66.11,Управление финансовыми рынками
66.11.1,Деятельность товарных бирж
66.11.2,"Деятельность, связанная с управлением финансовыми рынками"
66.11.3,Деятельность по ведению системы реестров держателей ценных бумаг и участников хозяйственных товариществ
66.12,Брокерская деятельность по сделкам с ценными бумагами и товарами
66.12.1,"Брокерская и дилерская деятельность, связанная с управлением активами Национального фонда, золотовалютными активами Национального Банка, пенсионными активами"
66.12.2,"Брокерская деятельность по сделкам с ценными бумагами и товарами, за исключением деятельности, связанной с управлением активами Национального фонда, золотовалютными активами Национального Банка, пенсионными активами"
66.19,"Прочая вспомогательная деятельность в сфере финансовых услуг, кроме страхования и пенсионного обеспечения"
66.19.0,"Прочая вспомогательная деятельность в сфере финансовых услуг, кроме страхования и пенсионного обеспечения"
66.21,Оценка страховых рисков и убытков
66.21.0,Оценка страховых рисков и убытков
66.22,Деятельность страховых агентов и брокеров
66.22.0,Деятельность страховых агентов и брокеров
66.29,Прочая вспомогательная деятельность по страхованию и пенсионному обеспечению
66.29.0,Прочая вспомогательная деятельность по страхованию и пенсионному обеспечению
66.30,Деятельность по управлению фондами
66.30.1,"Деятельность по управлению активами Национального фонда, золотовалютными активами Национального Банка, пенсионными активами"
66.30.2,Деятельность по доверительному управлению портфелем активов фондов
68,Операции с недвижимым имуществом
68.1,Покупка и продажа собственного недвижимого имущества
68.2,Аренда и управление собственной или арендуемой недвижимостью
68.3,Операции с недвижимым имуществом за вознаграждение или на договорной основе
68.10,Покупка и продажа собственного недвижимого имущества
68.10.1,Покупка и продажа многоквартирных и жилых домов (особняков)
68.10.2,Покупка и продажа прочей недвижимости
68.20,Аренда и управление собственной или арендуемой недвижимостью
68.20.1,Аренда (субаренда) и управление собственной или арендованной жилой недвижимостью
68.20.2,"Аренда (субаренда) и управление собственными или арендованными бизнес-центром, офисными помещениями, административным зданием"
68.20.3,Аренда (субаренда) и управление собственным или арендованным торговым рынком
68.20.4,Аренда и управление собственной торговой недвижимостью и многофункциональными комплексами в торговой деятельности
68.20.5,Аренда (субаренда) и управление арендуемой торговой недвижимостью и арендованными многофункциональными комплексами в торговой деятельности
68.20.6,"Аренда (субаренда) и управление собственными или арендованными встроенными, пристроенными нежилыми помещениями в жилых домах"
68.20.7,"Аренда (субаренда) и управление собственными или арендованными выставочным залом, конференц-залами"
68.20.8,Аренда (субаренда) и управление собственными или арендованными складскими помещениями
68.20.9,"Аренда (субаренда) и управление собственной или арендованной прочей недвижимостью, не включенной в другие группировки"
68.31,Деятельность агентств по операциям с недвижимым имуществом
68.31.1,Посреднические услуги при купле-продаже и сдаче внаем недвижимого имущества производственно-технического назначения
68.31.2,Посреднические услуги при купле-продаже и сдаче внаем жилья и другого недвижимого имущества непроизводственного назначения
68.32,Управление недвижимым имуществом за вознаграждение или на договорной основе
68.32.1,Управление недвижимостью за вознаграждение или на договорной основе
68.32.2,Обеспечение мер при эксплуатаций «Эталонного центра»
69,Деятельность в области права и бухгалтерского учета
69.1,Деятельность в области права
69.2,Деятельность в области бухгалтерского учета и аудита; консультирование по налогообложению
69.10,Деятельность в области права
69.10.1,Адвокатская деятельность
69.10.2,Нотариальная деятельность
69.10.9,Прочая деятельность в области права
69.20,Деятельность в области бухгалтерского учета и аудита; консультирование по налогообложению
69.20.1,Деятельность по проведению финансовой ревизии (аудита)
69.20.2,Деятельность в области составления счетов и бухгалтерского учета
69.20.3,Консультрование в области налогообложения
69.20.4,"Деятельность, связанная с неплатежеспособностью и взысканием задолженности"
69.20.5,"Деятельность в области бухгалтерского, налогового учета и казначейских операций для национального управляющего холдинга"
70,Деятельность головных компаний; консультирование по вопросам управления
70.1,Деятельность головных компаний
70.2,Деятельность по консультированию по вопросам управления
70.10,Деятельность головных компаний
70.10.1,"Деятельность головных компаний, связанная с реализацией государственной политики индустриально-инновационного развития"
70.10.9,Деятельность прочих головных компаний
70.21,Деятельность по взаимоотношениям и связью с общественностью
70.21.0,Деятельность по взаимоотношениям и связью с общественностью
70.22,Консультирование по вопросам коммерческой деятельности и прочее консультирование по вопросам управления
70.22.1,Консультирование по вопросам коммерческой деятельности и управления
70.22.2,Консультативное сопровождение концессионных проектов и проектов государственно-частного партнерства
71,"Деятельность в области архитектуры, инженерных изысканий, технических испытаний и анализа"
71.1,"Деятельность в области архитектуры, инженерных изысканий и предоставление технических консультаций в этих областях"
71.2,Технические испытания и анализы
71.11,Деятельность в области архитектуры
71.11.1,Деятельность в области архитектуры для объектов атомной промышленности и атомной энергетики
71.11.2,"Деятельность в области архитектуры, за исключением объектов атомной промышленности и атомной энергетики"
71.12,Деятельность в области инженерных изысканий и предоставление технических консультаций в этой области
71.12.1,"Деятельность в области инженерно-технического проектирования, за исключением объектов атомной промышленности и атомной энергетики"
71.12.2,Деятельность по проведению геологической разведки и изысканий (без научных исследований и разработок)
71.12.3,Геодезическая деятельность
71.12.4,Жерге орналастыру
71.12.5,Деятельность в области картографии
71.12.6,Деятельность в области инженерных изысканий и предоставление технических консультаций в этой области для объектов атомной промышленности и атомной энергетики
71.12.7,Деятельность по предоставлению инженерно-технических консультаций
71.12.8,"Деятельность в области технического регулирования, стандартизации, метрологии и оценки соответствия"
71.20,Технические испытания и анализы
71.20.1,Деятельность санитарно-эпидемиологических организаций
71.20.2,Деятельность организаций санитарного просвещения
71.20.3,Деятельность нефтеперерабатывающих заводов по осуществлению лабораторных испытаний и анализов
71.20.4,Лабораторно-аналитические исследования в геологической отрасли
71.20.5,"Деятельность по производству судебных экспертиз и исследований, кроме медицинских"
71.20.9,"Деятельность прочих учреждений, осуществляющих технические испытания и анализы"
72,Научные исследования и разработки
72.1,Научные исследования и экспериментальные разработки в области естественных и технических наук
72.2,Исследования и экспериментальные разработки в области общественных и гуманитарных наук
72.11,Научные исследования и экспериментальные разработки в области биотехнологий
72.11.0,Научные исследования и экспериментальные разработки в области биотехнологий
72.19,Прочие научные исследования и экспериментальные разработки в области естественных и технических наук
72.19.1,"Научные исследования и экспериментальные разработки в области проектирования, строительства, ремонта, содержания и диагностики автомобильных дорог и мостовых сооружений"
72.19.2,"Научно-исследовательские, опытно-методические и опытно-конструкторские работы в геологической отрасли"
72.19.3,Научные исследования и разработки в области космической деятельности
72.19.4,Исследования и экспериментальные разработки в области мирного использования атомной энергии
72.19.5,Исследования и разработки в области противоинфекционных препаратов
72.19.9,Прочие исследования и разработки в области естественных и технических наук
72.20,Исследования и экспериментальные разработки в области общественных и гуманитарных наук
72.20.1,"Прикладные исследования в области общественных и гуманитарных наук, направленные на содействие развитию отечественных производств"
72.20.2,"Прикладные исследования в области общественных и гуманитарных наук, направленных на развитие индустрии"
72.20.3,Исследования и экспериментальные разработки в области обороны и национальной безопасности
72.20.4,"Междисциплинарные исследования и разработки в области экономического, бюджетного и стратегического планирования"
72.20.9,"Исследования и экспериментальные разработки в области общественных и гуманитарных наук, не включенные в другие группировки"
73,Рекламная деятельность и исследование конъюнктуры рынка
73.1,Рекламная деятельность
73.2,Исследование конъюнктуры рынка и изучение общественного мнения
73.11,Деятельность рекламных агентств
73.11.0,Деятельность рекламных агентств
73.12,Размещение рекламы в средствах массовой информации
73.12.0,Размещение рекламы в средствах массовой информации
73.20,Исследование конъюнктуры рынка и изучение общественного мнения
73.20.0,Исследование конъюнктуры рынка и изучение общественного мнения
74,"Прочая профессиональная, научная и техническая деятельность"
74.1,Специализированная дизайнерская деятельность
74.2,Деятельность в области фотографии
74.3,Деятельность по устному и письменному переводу
74.9,"Прочая профессиональная, научная и техническая деятельность, не включенная в другие группировки"
74.10,Специализированная дизайнерская деятельность
74.10.0,Специализированная дизайнерская деятельность
